{
  "contract_version": "leos.approval-request.v1",
  "identity": {
    "resource_type": "APPROVAL_REQUEST",
    "resource_id": "approval-request:cloud-invoke:001",
    "display_name": "Cloud provider invocation approval request",
    "revision": "sha256:approval-request-cloud-invoke-001",
    "ownership": {
      "owner": {
        "principal_id": "principal:user:brett",
        "principal_type": "HUMAN_USER"
      },
      "creator": {
        "principal_id": "principal:employee:researcher",
        "principal_type": "EMPLOYEE"
      },
      "steward": {
        "principal_id": "principal:service:approval-authority",
        "principal_type": "SERVICE"
      },
      "lifecycle_authority": {
        "authority_id": "approval-authority",
        "principal": {
          "principal_id": "principal:service:approval-authority",
          "principal_type": "SERVICE"
        },
        "authority_revision": "sha256:approval-authority-policy-v1"
      }
    },
    "creation_actor_context_ref": {
      "resource_type": "ACTOR_CONTEXT",
      "resource_id": "actor-context:researcher:run-001",
      "revision": "sha256:actor-context-researcher-run-001"
    },
    "creation_authority_evidence_ref": {
      "authority_id": "authorization-authority",
      "reference_id": "authorization-decision:approval-request:001",
      "revision": "sha256:authorization-approval-request-001"
    },
    "audit_id": "audit:approval-request:cloud-invoke:001",
    "created_at": "2026-07-25T12:20:00Z",
    "updated_at": "2026-07-25T12:20:00Z"
  },
  "requested_by_actor_ref": {
    "evidence_type": "ACTOR_CONTEXT",
    "authority": {
      "authority_id": "identity-authority",
      "principal": {
        "principal_id": "principal:service:identity-authority",
        "principal_type": "SERVICE"
      },
      "authority_revision": "sha256:identity-authority-policy-v1"
    },
    "reference_id": "actor-context:researcher:run-001",
    "revision": "sha256:actor-context-researcher-run-001"
  },
  "scope": {
    "subject": {
      "principal_id": "principal:employee:researcher",
      "principal_type": "EMPLOYEE"
    },
    "action": "provider.invoke",
    "resource": {
      "resource_type": "PROVIDER",
      "resource_id": "provider:cloud:example",
      "revision": "sha256:provider-cloud-example-v1"
    },
    "context_type": "execution",
    "context_id": "execution:cloud:001",
    "context_revision": "sha256:execution-cloud-request-v1",
    "context_digest": "sha256:bbbbbbbbbbbbbbbbbbbbbbbbbbbbbbbbbbbbbbbbbbbbbbbbbbbbbbbbbbbbbbbb"
  },
  "reason": "The ranked cloud provider requires explicit human approval.",
  "requested_at": "2026-07-25T12:20:00Z",
  "expires_at": "2026-07-25T13:20:00Z"
}
